Post ID,Permalink,Post Message,Type,Countries,Languages,Posted,Audience Targeting,Lifetime Post Total Reach,Lifetime Post organic reach,Lifetime Post Paid Reach,Lifetime Post Total Impressions,Lifetime Post Organic Impressions,Lifetime Post Paid Impressions,Lifetime Engaged Users,Lifetime Matched Audience Targeting Consumers on Post,Lifetime Matched Audience Targeting Consumptions on Post,Lifetime Negative Feedback from Users,Lifetime Negative Feedback,Lifetime Post Impressions by people who have liked your Page,Lifetime Post reach by people who like your Page,Lifetime Post Paid Impressions by people who have liked your Page,Lifetime Paid reach of a post by people who like your Page,Lifetime People who have liked your Page and engaged with your post,Lifetime Organic views to 95%,Lifetime Organic views to 95%.1,Lifetime Paid views to 95%,Lifetime Paid views to 95%.1,Lifetime Organic Video Views,Lifetime Organic Video Views.1,Lifetime Paid Video Views,Lifetime Paid Video Views.1,Lifetime Average time video viewed,Lifetime Video length,Lifetime Talking About This (Post) by action type - like,Lifetime Talking About This (Post) by action type - share,Lifetime Talking About This (Post) by action type - comment,Lifetime Post Stories by action type - like,Lifetime Post Stories by action type - share,Lifetime Post Stories by action type - comment,Lifetime Post Audience Targeting Unique Consumptions by Type - other clicks,Lifetime Post Audience Targeting Unique Consumptions by Type - link clicks,Lifetime Post Audience Targeting Unique Consumptions by Type - video play,Lifetime Post Audience Targeting Unique Consumptions by Type - photo view,Lifetime Matched Audience Targeting Consumptions by Type - other clicks,Lifetime Matched Audience Targeting Consumptions by Type - link clicks,Lifetime Matched Audience Targeting Consumptions by Type - video play,Lifetime Matched Audience Targeting Consumptions by Type - photo view,Lifetime Negative Feedback from Users by Type - hide_all_clicks,Lifetime Negative Feedback from Users by Type - hide_clicks,Lifetime Negative Feedback by Type - hide_all_clicks,Lifetime Negative Feedback by Type - hide_clicks,Project ID
,,,,,,,,"Lifetime: The number of people who had your Page's post enter their screen. Posts include statuses, photos, links, videos and more. (Unique Users)",Lifetime: The number of people who had your Page's post enter their screen through unpaid distribution. (Unique Users),Lifetime: The number of people who had your Page's post enter their screen through paid distribution such as an ad. (Unique Users),"Lifetime: The number of times your Page's post entered a person's screen. Posts include statuses, photos, links, videos and more. (Total Count)",Lifetime: The number of times your Page's posts entered a person's screen through unpaid distribution. (Total Count),Lifetime: The number of times your Page's post entered a person's screen through paid distribution such as an ad. (Total Count),"Lifetime: The number of unique people who engaged in certain ways with your Page post, for example by commenting on, liking, sharing, or clicking upon particular elements of the post. (Unique Users)",Lifetime: The number of people who matched the audience targeting that clicked anywhere in your post on News Feed. (Unique Users),Lifetime: The number of clicks anywhere in your post on News Feed from the user that matched the audience targeting on it. (Total Count),Lifetime: The number of people who have given negative feedback to your post. (Unique Users),Lifetime: The number of times people have given negative feedback to your post. (Total Count),Lifetime: The number of impressions of your Page post to people who have liked your Page. (Total Count),Lifetime: The number of people who saw your Page post because they've liked your Page (Unique Users),Lifetime: The number of paid impressions of your Page post to people who have liked your Page. (Total Count),Lifetime: The number of people who like your Page and who saw your Page post in an ad or sponsored story. (Unique Users),Lifetime: The number of people who have liked your Page and clicked anywhere in your posts. (Unique Users),Lifetime: Number of times your video was viewed to 95% of its length without any paid promotion. (Unique Users),Lifetime: Number of times your video was viewed to 95% of its length without any paid promotion. (Total Count),Lifetime: Number of times your video was viewed to 95% of its length after paid promotion. (Unique Users),Lifetime: Number of times your video was viewed to 95% of its length after paid promotion. (Total Count),Lifetime: Number of times your video was viewed for more than 3 seconds without any paid promotion. (Unique Users),Lifetime: Number of times your video was viewed for more than 3 seconds without any paid promotion. (Total Count),Lifetime: Number of times your video was viewed more than 3 seconds after paid promotion. (Unique Users),Lifetime: Number of times your video was viewed more than 3 seconds after paid promotion. (Total Count),Lifetime: Average time video viewed (Total Count),Lifetime: Length of a video post (Total Count),Lifetime: The number of unique people who created a story about your Page post by interacting with it. (Unique Users),,,"Lifetime: The number of stories created about your Page post, by action type. (Total Count)",,,"Lifetime: The number of people who matched the audience targeting on the post that clicked anywhere in the post on News Feed, by type. (Unique Users)",,,,"Lifetime: The number of clicks anywhere in the post on News Feed from users that matched the audience targeting on the post, by type. (Total Count)",,,,"Lifetime: The number of times people have given negative feedback to your post, by type. (Total Count)",,"Lifetime: The number of people who have given negative feedback to your post, by type. (Unique Users)",,
357045034501999_788246651381833,https://www.facebook.com/weareotv/posts/788246651381833,"Enjoy this video of Aymar Jean Christian's CommFest presentation and Q&amp;A with #OTV artists Bea Cordelia Sullivan-Knoff and Daniel Kyri Madison, creators #TheTTV , Karan Sunil, creator of Code-Switched and Deja Harrell, creator of Seeds Series! 

The video includes an overview of Christian's research, an introduction to OTV - Open Television and some preliminary findings from the release of #BrownGirlsTV and Brujos.",Link,,,04/30/2018 03:00:01 PM, ,242,242,0,333,333,0,16,11,21,0,0,312,225,0,0,16,0,0,0,0,0,0,0,0,0,0,6,,,6,,,10,6.0,,,14,7.0,,,,,,,SDS|OTV|B
357045034501999_788228764716955,https://www.facebook.com/weareotv/posts/788228764716955,Tomorrow! Catch Seeds Series and a special sneak peek at Code-Switched at the The Midwest Independent Film Festival!,Link,,,04/30/2018 12:35:57 PM, ,67,67,0,95,95,0,4,1,1,0,0,78,52,0,0,2,0,0,0,0,0,0,0,0,0,0,3,,,3,,,1,,,,1,,,,,,,,SDS
357045034501999_788211341385364,https://www.facebook.com/weareotv/posts/788211341385364,"Our #mcm goes out to Daniel Kyri Madison co-creator of #TheTTV which will be hosted on OTV. They're just $100 away from $8000 and nearing their halfway point!

Jo (played by co-creator Bea Cordelia Sullivan-Knoff), a white trans woman craving an increasingly elusive intimacy, and Carter (played by Kyri), a queer Black man at odds with his conservative upbringing, converge from opposite sides of Chicago for a magical New Year's Eve night. As hangovers fade, and the two friends face awkward hook-ups, nervous dates, and the unlikely pursuit of lasting love, at least they have each other. 

Told in small, quotidian moments—by turns private, public, quietly tragic, and painfully hilarious—the T tells realer-to-life stories about the LGBTQ community than are often portrayed in mainstream media.",Link,,,04/30/2018 11:51:54 AM, ,286,286,0,374,374,0,16,14,18,0,0,352,269,0,0,16,0,0,0,0,0,0,0,0,0,0,5,,,5,,,9,6.0,,,10,8.0,,,,,,,HU|TT
357045034501999_786918754847956,https://www.facebook.com/weareotv/posts/786918754847956,"&quot;[Geeta's Guide To Moving On creator, Puja Mohindra] hopes Geeta's Guide to Moving On breaks down the perfect woman myth, lessens the pressure to &quot;have it all&quot; and prompts viewers to define success for themselves.&quot;

Watch #GeetasGuide now: http://www.weareo.tv/originals/geetas-guide-to-moving-on

#femalefilmmakerfriday",Link,,,04/27/2018 02:22:00 PM, ,244,244,0,295,295,0,7,4,4,0,0,217,177,0,0,5,0,0,0,0,0,0,0,0,0,0,3,1.0,,4,1.0,,1,3.0,,,1,3.0,,,,,,,GGMO
357045034501999_786953724844459,https://www.facebook.com/weareotv/posts/786953724844459,"Thank you Into for covering Brujos!

“I can't think of a show right now that is as multiracial as ours, that looks at queer sexuality as unabashedly as ours, that handles all of our issues as much as ours,” creator Ricardo Gamboa says. “Not like in a Glee way, where you can just tell that this is the episode where they're talking about this. … I'm not interested in representation, I’m interested in revolution.”",Link,,,04/27/2018 02:02:10 PM, ,385,385,0,513,513,0,26,13,14,1,1,496,372,0,0,26,0,0,0,0,0,0,0,0,0,0,16,,1.0,17,,1.0,10,4.0,,,10,4.0,,,1,,1,,B
357045034501999_786915464848285,https://www.facebook.com/weareotv/posts/786915464848285,"&quot;Black queer artists are having a moment, but you wouldn’t know if you consume black media... black media owners have yet to fully embrace intersectionality—the theory that folks who are marginalized by their race along with gender, sexuality, class and other characteristics have specific experiences and forms of oppression.&quot; 

- OTV - Open Television founder and head of development Aymar Jean Christian for Into.",Link,,,04/27/2018 12:02:22 PM, ,1271,1271,0,1701,1701,0,125,74,93,0,0,707,515,0,0,66,0,0,0,0,0,0,0,0,0,0,63,6.0,1.0,64,6.0,1.0,35,47.0,,,45,48.0,,,,,,,OTV
357045034501999_786512478221917,https://www.facebook.com/weareotv/posts/786512478221917,"Happy #LesbianVisibilityDay ! We're celebrating with the release of Quare Life Web Series created by M Shelly Conner. 

When her girlfriend not only rejects her marriage proposal but also breaks up with her, thirties-something Black professional Michelle Jones finds herself unemployed, unengaged, and without a home. In order to regroup, she moves in with her formerly homophobic mother and leans on her twin brother and close-knit group of friends for emotional support.

CAST // 
Ambria Sylvain (Michelle Jones)
Tara Smith (Dana Williams)
Dina Nina Martinez (Nari Diaz)
Dominica Strong (Pam Morris)",Link,,,04/26/2018 04:29:42 PM, ,1483,1483,0,2017,2017,0,64,48,68,0,0,337,246,0,0,15,0,0,0,0,0,0,0,0,0,0,24,11.0,5.0,31,11.0,6.0,30,22.0,,,45,23.0,,,,,,,QL
357045034501999_786413184898513,https://www.facebook.com/weareotv/posts/786413184898513,"You can now watch all of Geeta's Guide To Moving On season one at http://www.weareo.tv/originals/geetas-guide-to-moving-on !

When her fiancé, Dani, dumps her after 10 years of dating, Geeta loses her one true love. Refusing to believe it’s over, she moves in with her Indian family, in the hopes that she and Dani will eventually get back together. The way this all-American girl comes to accept this loss and learns to move on is a new take on the modern American self-love story. 

Created by Puja Mohindra.

Pick up where we left off last cycle and check out Episode 4 now.",Link,,,04/26/2018 09:42:09 AM, ,245,245,0,301,301,0,13,7,9,0,0,280,227,0,0,12,0,0,0,0,0,0,0,0,0,0,8,,,8,,,6,2.0,,,7,2.0,,,,,,,GGMO
357045034501999_786117718261393,https://www.facebook.com/weareotv/videos/786117718261393/,Q&amp;A with Geeta's Guide To Moving On creator Puja Mohindra and Quare Life Web Series creator M Shelly Conner.,Video,,,04/25/2018 05:43:52 PM, ,450,450,0,587,587,0,22,14,19,0,0,239,186,0,0,13,1,2,0,0,132,143,0,0,0,1277429,12,1.0,,12,1.0,,10,,6.0,,13,,6.0,,,,,,GGMO|QL
357045034501999_786014708271694,https://www.facebook.com/weareotv/videos/786014708271694/,"Tonight join us for the premiere of Quare Life Web Series, the comedy web series following the lives of four queer women of color in Chicago. #QuareLife is Girlfriends meets The L Word meets Awkward Black Girl. The series is written, produced, and created by M Shelly Conner, directed by Jessica King of King is a Fink Productions, and cinematography by Christian Mejía.  

OTV Presents: Geeta’s Guide to Moving On &amp; Quare Life 
RSVP: https://bit.ly/2H2KB0d",Video,,,04/25/2018 01:10:00 PM, ,1168,1168,0,1666,1666,0,88,56,78,0,0,363,286,0,0,23,33,33,0,0,237,265,0,0,0,49854,48,4.0,7.0,56,4.0,7.0,43,4.0,14.0,,60,4.0,14.0,,,,,,QL|QL
357045034501999_785977824942049,https://www.facebook.com/weareotv/posts/785977824942049,"“Inclusion allows us to show something that’s potentially different and allows us to connect with that,” Geeta's Guide To Moving On creator, Puja Mohindra says. “That connection fosters empathy, and that empathy is how this story can be revolutionary.” 

See the premiere of the ENTIRE first season of #GeetasGuide tonight at OTV Presents: Geeta’s Guide to Moving On &amp; Quare Life. Don't forget to RSVP: https://bit.ly/2H2KB0d

#OTVWednesday",Link,,,04/25/2018 09:31:55 AM, ,678,678,0,938,938,0,42,27,36,0,0,334,202,0,0,18,0,0,0,0,0,0,0,0,0,0,23,2.0,,24,2.0,,17,13.0,,,23,13.0,,,,,,,GGMO|QL
357045034501999_785553081651190,https://www.facebook.com/weareotv/posts/785553081651190,"When her girlfriend not only rejects her marriage proposal but also breaks up with her, thirties-something Black professional Michelle Jones finds herself unemployed, unengaged, and without a home. In order to regroup, she moves in with her formerly homophobic mother and leans on her twin brother and close-knit group of friends for emotional support.

Find out what happens next at OTV Presents: Geeta’s Guide to Moving On &amp; Quare Life this #OTVWednesday. Quare Life Web Series is created by M Shelly Conner and directed by Jessica King of King is a Fink Productions. Don't forget to RSVP: https://bit.ly/2H2KB0d",Photo,,,04/24/2018 10:33:04 AM, ,988,988,0,1446,1446,0,127,111,179,1,1,502,361,0,0,44,0,0,0,0,0,0,0,0,0,0,33,7.0,3.0,41,7.0,3.0,97,8.0,,37.0,134,8.0,,37.0,1,,1,,QL|QL
357045034501999_785147785025053,https://www.facebook.com/weareotv/posts/785147785025053,"The North Pole series writer and co-producer Josh Healy on using humor to tell stories about gentrification:

&quot;Doom and gloom ain’t going to get the job done and it’s not going to reach the people we want to talk to. Laughter is the way to bring people in. We want to acknowledge the reality of what’s going on and the pain and the anger and the sadness. Laughter is the way to deal with it and also to remind us of the joy and the humanity that we’re fighting for in the first place.&quot;

You can now watch all of The North Pole on #OTV! Enjoy: http://www.weareo.tv/represents//the-north-pole",Link,,,04/23/2018 03:07:00 PM, ,490,490,0,721,721,0,35,26,35,1,1,426,267,0,0,25,0,0,0,0,0,0,0,0,0,0,16,1.0,,17,1.0,,21,8.0,,,27,8.0,,,,1.0,,1.0,TNP|TNP
357045034501999_785139511692547,https://www.facebook.com/weareotv/posts/785139511692547,"This #OTVWednesday episodes 4-12 of Geeta's Guide To Moving On premiere right here on OTV! 

You know the drill - join us on 4/25 at Chicago Cultural Center from 6-8pm and don't forget to RSVP: https://bit.ly/2H2KB0d. See you soon. 

#weareotv",Link,,,04/23/2018 09:29:03 AM, ,138,138,0,177,177,0,6,1,1,0,0,161,124,0,0,6,0,0,0,0,0,0,0,0,0,0,5,,,5,,,,1.0,,,,1.0,,,,,,,GGMO
357045034501999_783973248475840,https://www.facebook.com/weareotv/posts/783973248475840,"In Quare Life Web Series by M Shelly Conner, four queer women of color negotiate professional and personal relationships on Chicago’s south side. 

Check it out next #OTVWednesday 4/25 6-8pm at Chicago Cultural Center! Don’t forget to RSVP: https://www.eventbrite.com/e/otv-presents-geetas-guide-to-moving-on-quare-life-tickets-45042311767",Link,,,04/20/2018 02:08:34 PM, ,35,35,0,48,48,0,3,0,0,0,0,24,17,0,0,2,0,0,0,0,0,0,0,0,0,0,3,,,4,,,,,,,,,,,,,,,QL
357045034501999_783577678515397,https://www.facebook.com/weareotv/posts/783577678515397,"Meet the Gidwanis next #OTVWednesday at OTV Presents: Geeta’s Guide to Moving On &amp; Quare Life

Don't forget to RSVP: https://bit.ly/2H2KB0d",Link,,,04/20/2018 01:24:00 PM, ,64,64,0,84,84,0,3,2,5,0,0,67,51,0,0,3,0,0,0,0,0,0,0,0,0,0,2,,,2,,,2,,,,5,,,,,,,,QL
357045034501999_783577475182084,https://www.facebook.com/weareotv/posts/783577475182084,"🤯🤯🤯 Thank you from the bottom of our black queer hearts to Patton Oswalt for this beautiful shout out! And big ups to FCK YES and YOGMA for doin the damn thing 💪🏾💪🏾💪🏾

We appreciate you supporting indie tv!",Status,,,04/19/2018 05:12:10 PM, ,625,625,0,908,908,0,136,116,179,0,0,847,580,0,0,132,0,0,0,0,0,0,0,0,0,0,50,,1.0,50,,1.0,112,13.0,,,166,13.0,,,,,,,FY|YMA
357045034501999_783460871860411,https://www.facebook.com/weareotv/posts/783460871860411,"The North Pole​ is now LIVE on weareo.tv ! 

We are honored to re-present this hilarious political comedy about today's most pressing social issues: Gentrification. Global Warming. And Gluten-Free Donuts.

Written and Produced by Josh Healey
Directed by Yvan Iturriaga 

Starring:
Reyna Amaya ('Nina')
Donte Clark ('Marcus') 
Eli Marienthal ('Finn') 
Santiago Rosas ('Benny')

Thanks to all that came out last night, catch us next #OTVWednesday 4/25 to watch OTV Presents: Geeta’s Guide to Moving On &amp; Quare Life​. #weareotv",Link,,,04/19/2018 10:24:33 AM, ,863,863,0,1245,1245,0,72,57,75,0,0,502,271,0,0,37,0,0,0,0,0,0,0,0,0,0,33,3.0,4.0,40,3.0,6.0,42,17.0,,,57,18.0,,,,,,,None
357045034501999_783080138565151,https://www.facebook.com/weareotv/posts/783080138565151,See how the girls have evolved from Nupita Obama Creates Vogua to Hair Story! Join us tonight: OTV Presents: Hair Story Sneak Preview + The North Pole Premiere.,Photo,,,04/18/2018 11:25:57 AM, ,135,135,0,196,196,0,16,14,20,0,0,179,120,0,0,16,0,0,0,0,0,0,0,0,0,0,5,,,5,,,14,,,1.0,19,,,1.0,,,,,NOCV|HS|HS|TNP
357045034501999_782644868608678,https://www.facebook.com/weareotv/posts/782644868608678,"Across seven outrageous episodes, Nina, Marcus, and Benny fight, dream, and plot hilarious schemes to save the place they call home. Facing both gentrification and global warming, they combat evil landlords, crazy geoengineering plots, and ultimately each other.

Join us for a screening of The North Pole on #OTVWednesday, tomorrow! OTV Presents: Hair Story Sneak Preview + The North Pole Premiere. Don't forget to RSVP: https://bit.ly/2qBQx67",SharedVideo,,,04/17/2018 10:35:56 AM, ,180,180,0,225,225,0,11,7,10,0,0,205,162,0,0,11,0,0,0,0,44,48,0,0,0,124286,5,,1.0,5,,1.0,7,1.0,,,9,1.0,,,,,,,TNP|HS|TNP
357045034501999_782298498643315,https://www.facebook.com/weareotv/posts/782298498643315,Come get all of this black brilliance this #OTVWednesday. Don't forget to RSVP! https://bit.ly/2qBQx67,Link,,,04/16/2018 06:29:00 PM, ,625,625,0,792,792,0,32,28,35,0,0,747,583,0,0,31,5,6,0,0,164,0,0,0,0,0,6,,2.0,7,,3.0,28,,,,35,,,,,,,,None
357045034501999_782297351976763,https://www.facebook.com/weareotv/posts/782297351976763,"FCK YES &quot;Highlights how affirmative consent is not only vital — but can be a really awesome turn on.&quot; - Huffington Post. 

In this episode #otvcommunity and co-creator of #TheTTV  Daniel Kyri Madison stars as half of a couple negotiating a threesome. 

FCK YES season 2 is written by Julie Keck and Jessica King of King is a Fink Productions.",Link,,,04/16/2018 03:12:53 PM, ,151,151,0,194,194,0,13,8,10,0,0,116,90,0,0,12,0,0,0,0,0,0,0,0,0,0,6,1.0,1.0,7,1.0,1.0,5,4.0,,,6,4.0,,,,,,,FY|FY
357045034501999_782235128649652,https://www.facebook.com/weareotv/posts/782235128649652,"April is #SexualAssaultAwarenessMonth, we're participating with the release of FCK YES, a modern sex-ed series showing all the ways consent can be fun and very sexy. Spice up your lunch break🤯🔥🔥

FCK YES is directed by Emily Best and written by Julie Keck and Jessica King of King is a Fink Productions. &quot;Fingers&quot; stars Marnie Alton and Erica C. Anderson. 

#SAAM",Link,,,04/16/2018 10:53:01 AM, ,206,206,0,293,293,0,21,17,22,0,0,222,148,0,0,19,0,0,0,0,0,0,0,0,0,0,9,1.0,,10,1.0,,12,7.0,,,13,9.0,,,,,,,FY|FY
357045034501999_782189141987584,https://www.facebook.com/weareotv/posts/782189141987584,"Relationships are containers for growth. Geeta's Guide To Moving On Season One premieres April 25, 2018! 

Event page: OTV Presents: Geeta’s Guide to Moving On &amp; Quare Life
RSVP: https://bit.ly/2H2KB0d",Link,,,04/16/2018 08:28:20 AM, ,73,73,0,92,92,0,3,0,0,0,0,84,66,0,0,3,0,0,0,0,0,0,0,0,0,0,3,,,3,,,,,,,,,,,,,,,GGMO|QL
357045034501999_781053048767860,https://www.facebook.com/weareotv/posts/781053048767860,"In case you missed it - check out the live Q&amp;A with the OTV Presents: F*ck Yes &amp; The Roach is Coming creators! From left to right: Julie Keck, Derrick Woods-Morrow, and Jessica King King is a Fink Productions. 

See you next time at OTV Presents: Hair Story Sneak Preview + The North Pole Premiere on 4/18. Don't forget to RSVP: https://bit.ly/2qrrphA",SharedVideo,,,04/13/2018 02:24:10 PM, ,31,31,0,38,38,0,0,0,0,0,0,24,18,0,0,0,0,0,0,0,14,14,0,0,0,1438834,,,,,,,,,,,,,,,,,,,FY|RIC|HS|TNP
357045034501999_780578602148638,https://www.facebook.com/weareotv/videos/780578602148638/,"Hair Story premieres this cycle! Stay tuned. 

“Hair Story” is a pilot for a web series that follows a group of Chicagoans in their everyday lives as they try to keep their co-op open and in their dreams, blending sitcom and music video.

// SONG //
CHAE BUTTUH - &quot;Shady Phat&quot;
Released on Futurehood -- futurehood.net",Video,,,04/12/2018 10:37:28 AM, ,3471,3471,0,5527,5527,0,481,428,669,0,0,1118,550,0,0,127,341,364,0,0,1275,1549,0,0,0,46931,154,11.0,17.0,194,12.0,19.0,393,4.0,93.0,,559,4.0,106.0,,,,,,HS|HS
357045034501999_780297545510077,https://www.facebook.com/weareotv/videos/780297545510077/,,Video,,,04/11/2018 05:33:44 PM, ,197,197,0,258,258,0,15,10,11,0,0,226,171,0,0,12,0,0,0,0,89,106,0,0,0,1438834,8,1.0,,8,2.0,,3,,8.0,,3,,8.0,,,,,,
357045034501999_779881925551639,https://www.facebook.com/weareotv/posts/779881925551639,"Tomorrow, come see the web series Refinery29 calls &quot;the sex-ed you wish you learned in high school&quot;. 

Join us on #OTVWednesday, we're screening FCK YES from King is a Fink Productions alongside Derrick Woods-Morrow's &quot;The Roach Is Coming&quot;.

OTV Presents: F*ck Yes &amp; The Roach is Coming
Don't forget to RSVP: https://bit.ly/2GRBCLe",Link,,,04/10/2018 06:57:44 PM, ,170,170,0,222,222,0,16,10,11,1,1,196,151,0,0,13,0,0,0,0,0,0,0,0,0,0,10,,,12,,,6,5.0,,,6,5.0,,,1,,1,,FY|FY|RIC
357045034501999_779463055593526,https://www.facebook.com/weareotv/posts/779463055593526,OTV - Open Television updated their status.,Status,,,04/09/2018 06:28:06 PM, ,93,93,0,151,151,0,3,3,6,0,0,141,84,0,0,3,0,0,0,0,0,0,0,0,0,0,,,,,,,3,,,,6,,,,,,,,OTV
357045034501999_779448115595020,https://www.facebook.com/weareotv/posts/779448115595020,"#OTVWednesday is back this week with &quot;F*CK YES&quot; by King is a Fink Productions and &quot;The Roach is Coming&quot; by Derrick Woods-Morrow. See you there, doors open at 6pm. 

Don't forget to RSVP: https://www.eventbrite.com/e/otv-presents-fck-yes-the-roach-is-coming-premiere-tickets-44484861418",Link,,,04/09/2018 05:26:37 PM, ,81,81,0,107,107,0,3,1,1,1,1,91,68,0,0,3,0,0,0,0,0,0,0,0,0,0,2,,,3,,,1,,,,1,,,,,1.0,,1.0,None
357045034501999_776657579207407,https://www.facebook.com/weareotv/posts/776657579207407,Our friends at ACRE TV are producing a livestreaming Telethon to support local Chicago experimental apartment cinema The Nightingale!  Attend in person or watch from home via ACRETV.org or Facebook Live. It's going to be wild!,SharedVideo,,,04/06/2018 11:00:00 AM, ,187,187,0,237,237,0,4,2,4,0,0,216,171,0,0,3,0,0,0,0,23,23,0,0,0,0,3,,,3,,,2,,,,4,,,,,,,,None
357045034501999_776658855873946,https://www.facebook.com/weareotv/posts/776658855873946,"There's no #OTVWednesday tonight (love you, miss you), we'll see you next Wednesday 4/11 for OTV Presents: F*ck Yes, Hair Story &amp; The Roach is Coming. 

While we wait, please support our friends at ACRE TV who are producing a livestreaming Telethon to support local Chicago experimental apartment cinema The Nightingale! Attend in person or watch from home via ACRETV.org or Facebook Live.",Link,,,04/04/2018 10:33:00 AM, ,270,270,0,333,333,0,13,6,7,0,0,299,238,0,0,12,1,1,0,0,10,0,0,0,0,0,7,,,7,,,6,,,,7,,,,,,,,FY|HS|RIC
357045034501999_776662419206923,https://www.facebook.com/weareotv/posts/776662419206923,"No #OTVWednesday this week, use that time to catch up on some fresh releases you may have missed, like Seeds Series created by Deja Harrell and C.J. Thomas. 

Centered around the friendship of four college-aged black girls, Seeds is a bold and dynamic narrative that explores the conversations between them through a hilariously authentic lens.

#SeedsSeries",Link,,,04/03/2018 10:36:00 AM, ,434,434,0,612,612,0,113,9,10,0,0,300,214,0,0,25,0,0,0,0,0,0,0,0,0,0,94,15.0,2.0,95,16.0,3.0,5,5.0,,,5,5.0,,,,,,,SDS|SDS
357045034501999_776278359245329,https://www.facebook.com/weareotv/posts/776278359245329,"We're taking a quick breather! There's no #OTVWednesday this week, take advantage of this time and catch up with all the excellent shows we've premiered this cycle, and take a look at what else is to come at weareo.tv.

At work and can't watch anything right now? Listen to this great, short interview with OTV founder Aymar Jean Christian on the inspiration for OTV and Chicago's fire web series scene.",Link,,,04/02/2018 02:00:00 PM, ,1011,1011,0,1682,1682,0,72,49,69,0,0,989,443,0,0,54,0,0,0,0,0,0,0,0,0,0,35,4.0,4.0,36,4.0,7.0,40,13.0,,,56,13.0,,,,,,,None
